{
  "schema": 1,
  "target": "samovar",
  "generation": 1,
  "created_at": "2026-09-22T12:00:00Z",
  "wifi": {
    "mode": "merge",
    "networks": [
      {
        "ssid": "TestWifi",
        "password": "testpassword123"
      }
    ]
  },
  "netbird": {
    "profile": "samovar",
    "management_url": "https://api.netbird.io:443",
    "setup_key": "test-setup-key-12345"
  },
  "mihomo": {
    "enabled": true,
    "config": {
      "mode": "rule",
      "mixed-port": 7890,
      "proxies": [
        {
          "name": "test-ss",
          "type": "ss",
          "server": "198.51.100.1",
          "port": 8388,
          "cipher": "aes-128-gcm",
          "password": "testpassword"
        }
      ],
      "proxy-groups": [
        {
          "name": "AUTO",
          "type": "select",
          "proxies": [
            "test-ss"
          ]
        }
      ],
      "rules": [
        "MATCH,DIRECT"
      ]
    }
  }
}
